{
  "$schema": "../../schema/lesson.schema.json",
  "id": "ai-04",
  "version": 1,
  "language": "he",
  "title": "אמיתי או נוצר בבינה מלאכותית?",
  "intro": [
    "בינה מלאכותית יכולה ליצור תמונות, סרטונים וקולות שנראים ונשמעים אמיתיים. חלק מהם נקראים דיפ־פייק.",
    "לפעמים יש רמזים, כמו ידיים מוזרות, כיתוב מטושטש או צללים שלא מתאימים. אבל בינה מלאכותית חדשה טועה פחות, אז רמזים לא מספיקים.",
    "הבדיקה הכי טובה היא המקור: מי פרסם את זה ראשון, והאם אתרי חדשות אמינים או מבוגרים אומרים אותו הדבר?"
  ],
  "game": {
    "type": "sort",
    "prompt": "האם כל אחת מהדרכים האלה טובה לבדוק אם משהו אמיתי?",
    "bins": [
      { "id": "good", "label": "דרך טובה לבדוק" },
      { "id": "not_good", "label": "לא דרך טובה לבדוק" }
    ],
    "items": [
      {
        "id": "who_posted",
        "text": "לברר מי פרסם את זה ראשון",
        "bin": "good",
        "explain": "לדעת מה המקור עוזר מאוד. אתר חדשות אמיתי אמין יותר מחשבון לא מוכר."
      },
      {
        "id": "news_sites",
        "text": "לבדוק אם אתרי חדשות אמינים מדווחים אותו הדבר",
        "bin": "good",
        "explain": "אם קרה משהו גדול באמת, גם החדשות האמינות ידווחו עליו."
      },
      {
        "id": "ask_adult",
        "text": "לשאול מבוגר שסומכים עליו",
        "bin": "good",
        "explain": "מבוגר יכול לעזור לבדוק ולהחליט."
      },
      {
        "id": "many_likes",
        "text": "יש לזה המון לייקים, אז זה בטח אמיתי",
        "bin": "not_good",
        "explain": "גם לדברים מזויפים יש הרבה לייקים. לייקים לא מראים מה נכון."
      },
      {
        "id": "looks_real",
        "text": "זה נראה מאוד אמיתי, אז זה בטח אמיתי",
        "bin": "not_good",
        "explain": "בינה מלאכותית יכולה ליצור דברים שנראים אמיתיים לגמרי. מראה אמיתי הוא לא הוכחה."
      },
      {
        "id": "friend_shared",
        "text": "חבר שיתף את זה, אז זה בטח אמיתי",
        "bin": "not_good",
        "explain": "גם חברים יכולים להתבלבל. בודקים מאיפה זה הגיע."
      }
    ]
  },
  "quiz": [
    {
      "id": "deepfake",
      "question": "מה זה דיפ־פייק?",
      "options": ["סרטון, תמונה או קול שבינה מלאכותית יצרה כדי שייראו אמיתיים", "בריכה עמוקה מאוד", "סוג של וירוס מחשב"],
      "answer": 0,
      "explain": "דיפ־פייק הוא תוכן מזויף שנוצר בבינה מלאכותית כך שייראה אמיתי."
    },
    {
      "id": "best_check",
      "question": "מה הדרך הכי טובה לבדוק סרטון מפתיע?",
      "options": ["לספור את הלייקים", "לבדוק מי פרסם אותו ואם מקורות אמינים מסכימים", "לצפות בו שוב"],
      "answer": 1,
      "explain": "המקור ומקורות אמינים אחרים אומרים הרבה יותר מלייקים."
    },
    {
      "id": "voice",
      "question": "שומעים הודעה קולית שנשמעת כמו זמרת מפורסמת שמבקשת כסף. מה חושבים?",
      "options": ["זה בטח אמיתי כי זה נשמע בדיוק אותו הדבר", "שולחים מהר את הכסף", "זה יכול להיות זיוף, אז לא סומכים ושואלים מבוגר"],
      "answer": 2,
      "explain": "בינה מלאכותית יכולה לחקות קולות. אף פעם לא שולחים כסף בגלל קול, ושואלים מבוגר."
    }
  ],
  "summary": "בינה מלאכותית יכולה ליצור תמונות, סרטונים וקולות מזויפים שנראים אמיתיים. לא סומכים על מראה או לייקים; בודקים את המקור ושואלים מבוגר שסומכים עליו."
}
