{
  "$schema": "../../schema/lesson.schema.json",
  "id": "aisec-03",
  "version": 1,
  "language": "he",
  "title": "לא מדביקים מידע פרטי בצ׳אטבוט",
  "intro": [
    "צ׳אטבוטים עוזרים עם שיעורי בית, רעיונות והסברים. אבל מה שכותבים או מדביקים בהם יכול להישמר ולהיקרא אחר כך.",
    "לכן לא כותבים בצ׳אטבוט סיסמאות, כתובת, מספר טלפון, תמונות של מסמכים או סודות של אחרים.",
    "כלל פשוט: מה שלא הייתם כותבים על הלוח בכיתה, לא כותבים בצ׳אטבוט."
  ],
  "game": {
    "type": "sort",
    "prompt": "מה בסדר לכתוב בצ׳אטבוט, ומה אף פעם לא?",
    "bins": [
      { "id": "ok", "label": "בסדר לכתוב" },
      { "id": "never", "label": "אף פעם לא" }
    ],
    "items": [
      {
        "id": "homework_question",
        "text": "שאלה על שברים משיעורי הבית",
        "bin": "ok",
        "explain": "שאלה ללמידה בלי פרטים אישיים היא בדיוק מה שצ׳אטבוט טוב בו."
      },
      {
        "id": "password_check",
        "text": "הסיסמה שלכם, כדי לבדוק אם היא חזקה",
        "bin": "never",
        "explain": "סיסמה כותבים רק במקום שלה. אפשר לשאול על הכללים בלי לכתוב אותה."
      },
      {
        "id": "own_story",
        "text": "סיפור דמיוני שכתבתם על דרקון, כדי לקבל רעיונות",
        "bin": "ok",
        "explain": "סיפור דמיוני בלי פרטים אמיתיים אפשר לשתף."
      },
      {
        "id": "passport_photo",
        "text": "תמונה של הדרכון או של תעודת הזהות של ההורים",
        "bin": "never",
        "explain": "מסמכים אישיים הם מהמידע הכי רגיש שיש. לא מדביקים אותם בצ׳אטבוט."
      },
      {
        "id": "spelling_words",
        "text": "רשימת מילים באנגלית לתרגול",
        "bin": "ok",
        "explain": "מילים לתרגול הן לא מידע אישי. בהצלחה!"
      },
      {
        "id": "friend_secret",
        "text": "סוד שחבר סיפר לכם",
        "bin": "never",
        "explain": "סודות של אחרים הם לא שלנו לשתף, גם לא עם צ׳אטבוט."
      }
    ]
  },
  "quiz": [
    {
      "id": "saved",
      "question": "מה יכול לקרות למה שכותבים בצ׳אטבוט?",
      "options": ["זה יכול להישמר ולהיקרא אחר כך", "זה נעלם לתמיד ברגע ששולחים", "אף אחד אף פעם לא יכול לראות את זה"],
      "answer": 0,
      "explain": "הודעות יכולות להישמר, לכן מידע פרטי נשאר מחוץ לצ׳אטבוט."
    },
    {
      "id": "strong_check",
      "question": "רוצים לדעת אם הסיסמה שלכם חזקה. מה עושים?",
      "options": ["מדביקים אותה בצ׳אטבוט", "שואלים מה עושה סיסמה לחזקה, בלי לכתוב אותה", "שולחים אותה לחבר שיבדוק"],
      "answer": 1,
      "explain": "אפשר ללמוד מה עושה סיסמה לחזקה בלי לחשוף אותה לאף אחד."
    },
    {
      "id": "document",
      "question": "צריך עזרה עם טופס שיש בו פרטים אישיים. מה עושים?",
      "options": ["מצלמים אותו ומדביקים בצ׳אטבוט", "מנחשים", "מבקשים עזרה מהורה"],
      "answer": 2,
      "explain": "טפסים עם פרטים אישיים ממלאים עם הורה, לא עם צ׳אטבוט."
    }
  ],
  "summary": "צ׳אטבוט הוא כלי טוב לשאלות ולרעיונות, אבל מה שכותבים בו יכול להישמר. סיסמאות, כתובות, מסמכים וסודות של אחרים לא כותבים בו אף פעם."
}
