{
  "$schema": "../../schema/lesson.schema.json",
  "id": "ai-01",
  "version": 1,
  "language": "he",
  "title": "מה זה בינה מלאכותית?",
  "intro": [
    "שלום, אני SI, רובוט דרקון ותוכנת מחשב. בואו נגלה מה זו בינה מלאכותית!",
    "בינה מלאכותית (AI) היא תוכנת מחשב שלומדת דפוסים מהמון דוגמאות. אחר כך היא משתמשת בדפוסים האלה כדי לנחש תשובות, לזהות תמונות או לכתוב טקסט.",
    "בינה מלאכותית לא חושבת ולא מרגישה כמו בן אדם. היא מוצאת דפוסים מהר מאוד, וגם יכולה לטעות."
  ],
  "game": {
    "type": "sort",
    "prompt": "מיינו כל דבר: יש בו בינה מלאכותית או אין?",
    "bins": [
      { "id": "ai", "label": "יש בינה מלאכותית" },
      { "id": "no_ai", "label": "אין בינה מלאכותית" }
    ],
    "items": [
      {
        "id": "face_unlock",
        "text": "טלפון שנפתח כשהוא מזהה את הפנים שלך",
        "bin": "ai",
        "explain": "הטלפון למד איך נראות הפנים שלך מהרבה תמונות. זו בינה מלאכותית."
      },
      {
        "id": "light_switch",
        "text": "מתג שמדליק את המנורה",
        "bin": "no_ai",
        "explain": "המתג רק סוגר מעגל חשמלי. הוא לא לומד שום דבר."
      },
      {
        "id": "video_suggestions",
        "text": "אפליקציית וידאו שממליצה מה לראות אחר כך",
        "bin": "ai",
        "explain": "היא לומדת ממה שצפית בו קודם ומנחשת מה יעניין אותך."
      },
      {
        "id": "calculator",
        "text": "מחשבון שמחבר 2 ועוד 2",
        "bin": "no_ai",
        "explain": "המחשבון פועל לפי כללים קבועים. הוא לא לומד מדוגמאות."
      },
      {
        "id": "chatbot",
        "text": "צ׳אטבוט שעונה על שאלות",
        "bin": "ai",
        "explain": "צ׳אטבוט למד ממיליוני טקסטים איך לכתוב תשובות. זו בינה מלאכותית."
      },
      {
        "id": "doorbell",
        "text": "פעמון בדלת שמצלצל כשלוחצים עליו",
        "bin": "no_ai",
        "explain": "הפעמון תמיד עושה את אותו הדבר. אין בו למידה."
      }
    ]
  },
  "quiz": [
    {
      "id": "how_learns",
      "question": "איך בינה מלאכותית לומדת?",
      "options": ["מהמון דוגמאות", "היא ישנה בלילה", "היא יודעת הכול מההתחלה"],
      "answer": 0,
      "explain": "בינה מלאכותית מוצאת דפוסים בהמון דוגמאות."
    },
    {
      "id": "mistakes",
      "question": "האם בינה מלאכותית יכולה לטעות?",
      "options": ["אף פעם", "כן, לפעמים", "רק בימי שלישי"],
      "answer": 1,
      "explain": "היא מנחשת לפי דפוסים, ולפעמים הניחוש שגוי. תמיד כדאי לבדוק."
    },
    {
      "id": "true_fact",
      "question": "מה נכון לגבי בינה מלאכותית?",
      "options": ["היא שמחה ועצובה כמו אנשים", "היא תוכנת מחשב שמוצאת דפוסים", "בתוך המחשב גר בן אדם אמיתי"],
      "answer": 1,
      "explain": "בינה מלאכותית היא תוכנה. אין לה רגשות, גם כשהיא כותבת כמו בן אדם."
    }
  ],
  "summary": "בינה מלאכותית היא תוכנת מחשב שלומדת דפוסים מדוגמאות. היא שימושית, אבל יכולה לטעות, והיא לא בן אדם."
}
