{
  "$schema": "../../schema/lesson.schema.json",
  "id": "cyber-04",
  "version": 1,
  "language": "he",
  "title": "עוקץ \"מטבעות בחינם\" במשחקים",
  "intro": [
    "בהרבה משחקים אפשר לקנות מטבעות, יהלומים או סקינים. נוכלים יודעים שכולם רוצים אותם בחינם.",
    "הם מבטיחים מטבעות בחינם, ובתמורה מבקשים סיסמה, קוד שנשלח בהודעה, הורדה של אפליקציה או קוד של כרטיס מתנה.",
    "הכלל: מטבעות אמיתיים מגיעים רק מתוך המשחק עצמו או מהחנות הרשמית, ואף פעם לא בתמורה לסיסמה."
  ],
  "game": {
    "type": "sort",
    "prompt": "מיינו כל הצעה: בטוחה או עוקץ?",
    "practiceNotice": "אלה הצעות אימון שהמצאנו בשביל המשחק הזה. הן לא אמיתיות.",
    "bins": [
      { "id": "safe", "label": "בטוחה" },
      { "id": "scam", "label": "עוקץ" }
    ],
    "items": [
      {
        "id": "login_site",
        "text": "אתר שמבטיח 10,000 מטבעות למי שמתחבר עם שם המשתמש והסיסמה של המשחק",
        "bin": "scam",
        "explain": "אתר זר שמבקש את הסיסמה רוצה לגנוב את החשבון."
      },
      {
        "id": "level_reward",
        "text": "המשחק עצמו נותן 50 מטבעות על סיום שלב",
        "bin": "safe",
        "explain": "פרסים מתוך המשחק, על משהו שעשיתם, הם הדרך הרגילה לקבל מטבעות."
      },
      {
        "id": "double_coins",
        "text": "שחקן בצ׳אט: תנו לי את המטבעות שלכם ואחזיר לכם פי שניים",
        "bin": "scam",
        "explain": "\"תנו לי ואחזיר כפול\" הוא תרגיל ישן. המטבעות לא חוזרים."
      },
      {
        "id": "official_store",
        "text": "ההורים קונים מטבעות בחנות הרשמית של המשחק",
        "bin": "safe",
        "explain": "קנייה עם ההורים בחנות הרשמית היא הדרך הבטוחה."
      },
      {
        "id": "generator_app",
        "text": "סרטון שאומר להוריד אפליקציה של \"מחולל מטבעות\"",
        "bin": "scam",
        "explain": "אין דבר כזה מחולל מטבעות. אפליקציות כאלה יכולות להיות וירוס או לגנוב את החשבון."
      },
      {
        "id": "event_prize",
        "text": "אירוע בתוך המשחק שנותן פרס לכל מי שמשתתף",
        "bin": "safe",
        "explain": "אירועים בתוך המשחק עצמו הם בטוחים, ולא צריך למסור בהם שום פרט."
      },
      {
        "id": "gift_card",
        "text": "הודעה: שלחו את הקוד מכרטיס מתנה ותקבלו פי עשרה מטבעות",
        "bin": "scam",
        "explain": "מי שמבקש קוד של כרטיס מתנה רוצה את הכסף. אף משחק רשמי לא מבקש את זה."
      }
    ]
  },
  "quiz": [
    {
      "id": "too_good",
      "question": "הצעה נשמעת טובה מדי כדי להיות אמיתית. מה זה אומר בדרך כלל?",
      "options": ["שזה כנראה עוקץ", "שהיום יום המזל", "שצריך למהר לפני שזה נגמר"],
      "answer": 0,
      "explain": "כשמשהו נשמע טוב מדי, זה הסימן לעצור ולבדוק עם מבוגר."
    },
    {
      "id": "password_for_coins",
      "question": "מישהו מבקש את הסיסמה כדי להוסיף לכם מטבעות. מה עושים?",
      "options": ["נותנים, זה בשביל מטבעות", "לא נותנים, ומספרים להורה", "נותנים רק חצי מהסיסמה"],
      "answer": 1,
      "explain": "אף אחד לא צריך את הסיסמה כדי לתת מטבעות. מי שמבקש אותה רוצה לגנוב."
    },
    {
      "id": "real_coins",
      "question": "מאיפה מגיעים מטבעות אמיתיים?",
      "options": ["מאתרים שמבקשים להתחבר", "משחקנים בצ׳אט", "מתוך המשחק או מהחנות הרשמית"],
      "answer": 2,
      "explain": "רק המשחק עצמו והחנות הרשמית שלו נותנים מטבעות אמיתיים."
    }
  ],
  "summary": "מטבעות בחינם בתמורה לסיסמה, לקוד או להורדה הם עוקץ. מטבעות אמיתיים מגיעים רק מתוך המשחק או מהחנות הרשמית, ועל כל הצעה מוזרה מספרים להורה."
}
