{
  "$schema": "../../schema/lesson.schema.json",
  "id": "cyber-01",
  "version": 1,
  "language": "he",
  "title": "סיסמאות חזקות",
  "intro": [
    "סיסמה היא המפתח לחשבונות שלכם. מי שיודע אותה יכול להיכנס, לשחק במקומכם ואפילו לשנות דברים.",
    "הסיסמאות הכי חזקות הן ארוכות. אפשר לחבר כמה מילים אקראיות למשפט מצחיק, למשל 'דרקון סגול אוכל פיצה על הירח'.",
    "סיסמה טובה היא גם סודית ושונה בכל חשבון. רק אתם וההורים יודעים אותה."
  ],
  "game": {
    "type": "sort",
    "prompt": "מיינו כל סיסמה: חזקה או חלשה?",
    "bins": [
      { "id": "strong", "label": "חזקה" },
      { "id": "weak", "label": "חלשה" }
    ],
    "items": [
      {
        "id": "numbers",
        "text": "123456",
        "bin": "weak",
        "explain": "זו אחת הסיסמאות הנפוצות בעולם. מחשב מנחש אותה תוך שנייה."
      },
      {
        "id": "four_words",
        "text": "ענן כתום רוקד עם מטרייה",
        "bin": "strong",
        "explain": "ארבע מילים אקראיות יוצרות סיסמה ארוכה שקשה לנחש וקל לזכור."
      },
      {
        "id": "pet_name",
        "text": "השם של הכלב שלכם",
        "bin": "weak",
        "explain": "חברים ואנשים ברשת יכולים לדעת את השם הזה או לנחש אותו."
      },
      {
        "id": "long_sentence",
        "text": "הצב שלי רץ מהר יותר מאוטובוס כחול",
        "bin": "strong",
        "explain": "משפט ארוך ומשונה הוא סיסמה חזקה, כל עוד לא משתפים אותו."
      },
      {
        "id": "password1",
        "text": "password1",
        "bin": "weak",
        "explain": "מילה מוכרת עם מספר בסוף היא מהניחושים הראשונים של פורצים."
      },
      {
        "id": "same_everywhere",
        "text": "סיסמה ארוכה וטובה, אבל אותה אחת בכל המשחקים",
        "bin": "weak",
        "explain": "אם משחק אחד נפרץ, כל החשבונות האחרים בסכנה. לכל חשבון סיסמה משלו."
      }
    ]
  },
  "quiz": [
    {
      "id": "strongest",
      "question": "איזו סיסמה הכי חזקה?",
      "options": ["חתול ירוק שותה מיץ על הגג", "abc123", "תאריך יום ההולדת שלכם"],
      "answer": 0,
      "explain": "כמה מילים אקראיות ביחד יוצרות סיסמה ארוכה וקשה לניחוש."
    },
    {
      "id": "reuse",
      "question": "למה לא משתמשים באותה סיסמה בכל מקום?",
      "options": ["כי זה משעמם", "כי אם היא נחשפת במקום אחד, כל החשבונות בסכנה", "כי המחשב מתבלבל"],
      "answer": 1,
      "explain": "סיסמה שונה לכל חשבון שומרת על השאר, גם אם אחד נפרץ."
    },
    {
      "id": "share",
      "question": "חבר טוב מבקש את הסיסמה שלכם למשחק. מה עושים?",
      "options": ["משתפים, חברים משתפים הכול", "משתפים רק אם מבטיחים לשמור בסוד", "לא משתפים. את הסיסמה יודעים רק אתם וההורים"],
      "answer": 2,
      "explain": "גם חברים טובים לא צריכים את הסיסמה. ככה החשבון נשאר רק שלכם."
    }
  ],
  "summary": "סיסמה חזקה היא ארוכה, למשל כמה מילים אקראיות ביחד. היא שונה בכל חשבון, ואותה יודעים רק אתם וההורים."
}
