{
  "$schema": "../../schema/lesson.schema.json",
  "id": "ai-02",
  "version": 1,
  "language": "he",
  "title": "איך בינה מלאכותית לומדת מדוגמאות",
  "intro": [
    "בינה מלאכותית לומדת כמו בלש שאוסף הרבה רמזים. אנשים מראים לה המון דוגמאות, ולכל דוגמה יש תווית, למשל תמונה שכתוב עליה 'תפוח'.",
    "מאלפי דוגמאות היא מוצאת דפוסים: תפוחים הם בדרך כלל עגולים, אדומים או ירוקים, עם גבעול קטן.",
    "דוגמאות טובות מלמדות אותה טוב. דוגמאות שגויות או מבלבלות מלמדות אותה טעויות. לכן הדוגמאות חשובות מאוד!"
  ],
  "game": {
    "type": "sort",
    "prompt": "עזרו לרובוט ללמוד איך נראה תפוח. כל דוגמה עוזרת לו או מבלבלת אותו?",
    "bins": [
      { "id": "helps", "label": "עוזרת ללמוד" },
      { "id": "confuses", "label": "מבלבלת" }
    ],
    "items": [
      {
        "id": "red_apple",
        "text": "תמונה ברורה של תפוח אדום, עם התווית 'תפוח'",
        "bin": "helps",
        "explain": "תמונה ברורה עם התווית הנכונה היא דוגמה מצוינת."
      },
      {
        "id": "tomato",
        "text": "תמונה של עגבנייה, עם התווית 'תפוח'",
        "bin": "confuses",
        "explain": "התווית שגויה, אז הרובוט לומד שעגבניות הן תפוחים."
      },
      {
        "id": "green_apple",
        "text": "תמונה של תפוח ירוק, עם התווית 'תפוח'",
        "bin": "helps",
        "explain": "יש תפוחים בצבעים שונים. גיוון עוזר לרובוט לזהות את כולם."
      },
      {
        "id": "dark_photo",
        "text": "תמונה חשוכה ומטושטשת מאוד, עם התווית 'תפוח'",
        "bin": "confuses",
        "explain": "אם אי אפשר לראות את התפוח, גם הרובוט לא יכול ללמוד מהתמונה."
      },
      {
        "id": "banana",
        "text": "תמונה של בננה, עם התווית 'תפוח'",
        "bin": "confuses",
        "explain": "עוד תווית שגויה. הרובוט עלול להתחיל לקרוא לבננות תפוחים."
      },
      {
        "id": "bitten_apple",
        "text": "תמונה של תפוח אכול עד חציו, עם התווית 'תפוח'",
        "bin": "helps",
        "explain": "תפוחים לא תמיד נראים מושלמים. דוגמאות מהחיים האמיתיים עוזרות לרובוט."
      }
    ]
  },
  "quiz": [
    {
      "id": "labels",
      "question": "מה זו תווית באימון של בינה מלאכותית?",
      "options": ["שם שאומר לבינה המלאכותית מה יש בדוגמה", "מדבקה על המחשב", "הצבע האהוב על הבינה המלאכותית"],
      "answer": 0,
      "explain": "תווית אומרת לבינה המלאכותית מה מופיע בכל דוגמה, למשל 'תפוח' או 'חתול'."
    },
    {
      "id": "wrong_labels",
      "question": "מה קורה אם להרבה דוגמאות יש תוויות שגויות?",
      "options": ["הבינה המלאכותית מתקנת אותן לבד", "הבינה המלאכותית לומדת את הטעויות", "שום דבר לא משתנה"],
      "answer": 1,
      "explain": "בינה מלאכותית לומדת ממה שמראים לה, כולל מהטעויות."
    },
    {
      "id": "variety",
      "question": "למה כדאי להראות לבינה המלאכותית תפוחים בהרבה צבעים וצורות?",
      "options": ["כדי שהיא תהיה רעבה", "זה לא משנה", "כדי שהיא תזהה כל מיני תפוחים"],
      "answer": 2,
      "explain": "ככל שהדוגמאות מגוונות יותר, היא מזהה יותר סוגים של תפוחים."
    }
  ],
  "summary": "בינה מלאכותית לומדת דפוסים מהמון דוגמאות עם תוויות. דוגמאות ברורות, נכונות ומגוונות מלמדות אותה טוב, ודוגמאות שגויות מלמדות אותה טעויות."
}
