{
  "$schema": "../../schema/lesson.schema.json",
  "id": "aisec-02",
  "version": 1,
  "language": "he",
  "title": "הונאות עם קול משוכפל ומילת קוד משפחתית",
  "intro": [
    "בינה מלאכותית יכולה לחקות קול של אדם אמיתי מכמה שניות של הקלטה. נוכלים משתמשים בזה כדי להישמע כמו מישהו מהמשפחה.",
    "הסימנים: שיחה או הודעה קולית דחופה, בקשה לכסף, לקוד או לפרטים, ובקשה לא לספר לאף אחד.",
    "הפתרון: מילת קוד משפחתית שרק המשפחה יודעת. אם הקול לא יודע אותה, מנתקים ומתקשרים להורה במספר הרגיל."
  ],
  "game": {
    "type": "sort",
    "prompt": "מיינו כל שיחה או הודעה: רגילה או חשודה?",
    "practiceNotice": "אלה מצבי אימון שהמצאנו בשביל המשחק הזה. הם לא אמיתיים.",
    "bins": [
      { "id": "normal", "label": "רגילה" },
      { "id": "suspicious", "label": "חשודה" }
    ],
    "items": [
      {
        "id": "crying_cousin",
        "text": "שיחה בקול של בן דוד שבוכה ומבקש שתשלחו לו מהר את הקוד שהגיע לטלפון של אמא",
        "bin": "suspicious",
        "explain": "בכי, לחץ ובקשה לקוד הם סימנים של עוקץ. מנתקים ומספרים להורה."
      },
      {
        "id": "grandma_code",
        "text": "סבתא מתקשרת, אומרת את מילת הקוד המשפחתית ושואלת מה שלומכם",
        "bin": "normal",
        "explain": "היא יודעת את מילת הקוד ולא מבקשת שום דבר מוזר. שיחה רגילה."
      },
      {
        "id": "singer_video",
        "text": "סרטון של זמר מפורסם שמבטיח כסף לכל מי שישלח את פרטי כרטיס האשראי של ההורים",
        "bin": "suspicious",
        "explain": "קל לזייף קול ופנים של מפורסמים. מפורסמים אמיתיים לא מבקשים פרטי כרטיס."
      },
      {
        "id": "dad_text",
        "text": "אבא שולח הודעה מהמספר הרגיל שלו: \"אני מאחר בעשר דקות\"",
        "bin": "normal",
        "explain": "הודעה רגילה מהמספר המוכר, בלי בקשות מוזרות."
      },
      {
        "id": "dont_tell_mom",
        "text": "הודעה קולית שנשמעת כמו אח גדול: \"אני בצרות, תשלחו כסף ואל תספרו לאמא\"",
        "bin": "suspicious",
        "explain": "\"אל תספרו\" ביחד עם בקשה לכסף הם סימן אזהרה. בודקים עם הורה."
      },
      {
        "id": "teacher_message",
        "text": "המורה שולחת בקבוצת הכיתה תזכורת להביא מחר כובע",
        "bin": "normal",
        "explain": "תזכורת רגילה בקבוצה מוכרת, בלי לחץ ובלי בקשות לפרטים."
      }
    ]
  },
  "quiz": [
    {
      "id": "code_word",
      "question": "מה זו מילת קוד משפחתית?",
      "options": ["מילה סודית שרק המשפחה יודעת, כדי לבדוק מי באמת מדבר", "הסיסמה של הוויי-פיי", "שם של משחק"],
      "answer": 0,
      "explain": "מילת הקוד עוזרת לגלות אם הקול באמת שייך למי שהוא טוען שהוא."
    },
    {
      "id": "urgent_call",
      "question": "קול שנשמע כמו הורה מבקש כסף בדחיפות ולא יודע את מילת הקוד. מה עושים?",
      "options": ["שולחים מהר, זה דחוף", "מנתקים ומתקשרים להורה במספר הרגיל", "ממשיכים לדבר כדי לבדוק"],
      "answer": 1,
      "explain": "מתקשרים בעצמכם למספר המוכר. ככה מגלים מהר אם זה באמת ההורה."
    },
    {
      "id": "can_ai",
      "question": "בינה מלאכותית יכולה לחקות קול של מישהו שאתם מכירים?",
      "options": ["לא, זה בלתי אפשרי", "רק קולות של רובוטים", "כן, לפעמים מכמה שניות של הקלטה"],
      "answer": 2,
      "explain": "לכן קול מוכר לבד הוא לא הוכחה. מילת הקוד היא הבדיקה."
    }
  ],
  "summary": "בינה מלאכותית יכולה לחקות קולות. כששיחה דחופה מבקשת כסף, קוד או סוד, בודקים את מילת הקוד המשפחתית, ואם משהו לא מסתדר, מנתקים ומתקשרים להורה במספר הרגיל."
}
