{
  "$schema": "../../schema/lesson.schema.json",
  "id": "cyber-03",
  "version": 1,
  "language": "he",
  "title": "מה פרטי ומה אפשר לשתף",
  "intro": [
    "יש מידע שכיף לשתף ברשת, כמו הצבע האהוב או ציור שציירתם.",
    "ויש מידע פרטי, שעוזר לזרים למצוא אתכם או להיכנס לחשבונות שלכם: כתובת, בית ספר, מספר טלפון, סיסמה ותמונות שמראות איפה אתם.",
    "לפני ששולחים, שואלים: זה עוזר למישהו לדעת מי אני ואיפה אני? אם כן, זה פרטי. כשלא בטוחים, שואלים מבוגר."
  ],
  "game": {
    "type": "sort",
    "prompt": "מה פרטי ומה אפשר לשתף במשחק או בצ׳אט?",
    "bins": [
      { "id": "share", "label": "אפשר לשתף" },
      { "id": "private", "label": "פרטי" }
    ],
    "items": [
      {
        "id": "home_address",
        "text": "הכתובת של הבית שלכם",
        "bin": "private",
        "explain": "כתובת אומרת לזרים איפה בדיוק אתם גרים."
      },
      {
        "id": "fav_color",
        "text": "הצבע האהוב עליכם",
        "bin": "share",
        "explain": "צבע אהוב לא עוזר לאף אחד למצוא אתכם. כיף לשתף!"
      },
      {
        "id": "school_name",
        "text": "השם של בית הספר שלכם",
        "bin": "private",
        "explain": "בית הספר אומר איפה אתם נמצאים כמעט כל יום."
      },
      {
        "id": "dragon_drawing",
        "text": "ציור של דרקון שציירתם",
        "bin": "share",
        "explain": "ציור הוא דרך מצוינת לשתף בלי לגלות פרטים."
      },
      {
        "id": "password",
        "text": "הסיסמה למשחק",
        "bin": "private",
        "explain": "סיסמה לא משתפים אף פעם, חוץ מעם ההורים."
      },
      {
        "id": "book_opinion",
        "text": "מה חשבתם על ספר שקראתם",
        "bin": "share",
        "explain": "דעות ותחביבים אפשר לשתף. רק לא מוסיפים פרטים כמו שם מלא או כתובת."
      },
      {
        "id": "uniform_photo",
        "text": "תמונה שלכם עם הסמל של בית הספר על החולצה",
        "bin": "private",
        "explain": "גם תמונה יכולה לגלות איפה אתם. בודקים מה רואים ברקע ועל הבגדים."
      }
    ]
  },
  "quiz": [
    {
      "id": "which_private",
      "question": "מה מכל אלה פרטי?",
      "options": ["החיה האהובה עליכם", "מספר הטלפון שלכם", "המשחק האהוב עליכם"],
      "answer": 1,
      "explain": "מספר טלפון מאפשר לזרים ליצור איתכם קשר, אז הוא נשאר פרטי."
    },
    {
      "id": "photo",
      "question": "רוצים לשלוח תמונה. מה בודקים קודם?",
      "options": ["שלא רואים בה כתובת, שלט רחוב או סמל של בית ספר", "שהיא צבעונית מספיק", "שיש בה לפחות שלושה אנשים"],
      "answer": 0,
      "explain": "פרטים קטנים ברקע יכולים לגלות איפה אתם."
    },
    {
      "id": "unsure",
      "question": "לא בטוחים אם משהו פרטי. מה עושים?",
      "options": ["שולחים בכל זאת", "מנחשים", "שואלים הורה או מבוגר אחר שסומכים עליו"],
      "answer": 2,
      "explain": "כשלא בטוחים, עוצרים ושואלים. עדיף לשאול מאשר להצטער."
    }
  ],
  "summary": "מידע פרטי, כמו כתובת, בית ספר, טלפון וסיסמה, נשאר אצלנו. תחביבים, דעות וציורים אפשר לשתף. כשלא בטוחים, שואלים מבוגר."
}
