{
  "$schema": "../../schema/lesson.schema.json",
  "id": "cyber-06",
  "version": 1,
  "language": "he",
  "title": "מספרים למבוגר שסומכים עליו",
  "intro": [
    "לפעמים קורה ברשת משהו מפחיד, מבלבל או לא נעים. זה לא אשמתכם, וזה קורה גם לילדים אחרים.",
    "מבוגר שסומכים עליו, כמו הורה, מורה או מישהו מצוות בית הספר, רוצה לדעת ויכול לעזור. לספר זה הצעד הנכון.",
    "כשמישהו ברשת מבקש לשמור משהו בסוד מההורים, זה סימן ברור לספר. הפתעה ליום הולדת זה בסדר, כי בסוף כולם יודעים."
  ],
  "game": {
    "type": "sort",
    "prompt": "מה עושים בכל מצב?",
    "bins": [
      { "id": "handle", "label": "מסתדרים לבד" },
      { "id": "tell", "label": "מספרים למבוגר" }
    ],
    "items": [
      {
        "id": "secret_request",
        "text": "מישהו שהכרתם במשחק כותב: \"אל תספרו להורים שאנחנו מדברים\"",
        "bin": "tell",
        "explain": "בקשה לשמור סוד מההורים היא סימן אזהרה. מספרים מיד."
      },
      {
        "id": "avatar_color",
        "text": "לא מצליחים להחליט באיזה צבע לצבוע את הדמות במשחק",
        "bin": "handle",
        "explain": "זו החלטה שלכם. בוחרים לבד ונהנים."
      },
      {
        "id": "photo_request",
        "text": "מישהו ברשת מבקש שתשלחו לו תמונה שלכם",
        "bin": "tell",
        "explain": "לא שולחים תמונות לאנשים מהרשת, ומספרים למבוגר שסומכים עליו."
      },
      {
        "id": "funny_joke",
        "text": "חבר מהכיתה שלח לכם בדיחה מצחיקה ונחמדה",
        "bin": "handle",
        "explain": "בדיחה נחמדה ממישהו שמכירים היא בסדר גמור."
      },
      {
        "id": "scary_video",
        "text": "ראיתם סרטון מפחיד שלא יוצא לכם מהראש",
        "bin": "tell",
        "explain": "לדבר עם מבוגר על מה שראיתם עוזר להרגיש טוב יותר."
      },
      {
        "id": "mean_messages",
        "text": "מישהו שולח לכם הודעות מעליבות שוב ושוב",
        "bin": "tell",
        "explain": "הודעות מעליבות שחוזרות שוב ושוב הן בריונות ברשת. שומרים צילום מסך ומספרים למבוגר."
      }
    ]
  },
  "quiz": [
    {
      "id": "who",
      "question": "מי זה מבוגר שסומכים עליו?",
      "options": ["הורה, מורה או מבוגר מוכר שאכפת לו מכם", "כל מי שכותב ברשת שהוא מבוגר", "דמות במשחק"],
      "answer": 0,
      "explain": "מבוגר שסומכים עליו הוא מישהו שמכירים בחיים האמיתיים ושאכפת לו מכם."
    },
    {
      "id": "trouble",
      "question": "חוששים לספר כי אולי מישהו יכעס. מה נכון?",
      "options": ["עדיף לשתוק", "לספר זה הצעד הנכון, ומבוגר שסומכים עליו ירצה לעזור", "מספרים רק אם זה קרה יותר מעשר פעמים"],
      "answer": 1,
      "explain": "גם אם הייתה טעות, מבוגר שסומכים עליו יעדיף לדעת ולעזור."
    },
    {
      "id": "secret",
      "question": "מה ההבדל בין הפתעה לבין סוד שצריך לספר עליו?",
      "options": ["אין הבדל", "הפתעה תמיד מפחידה", "הפתעה נגמרת כשכולם יודעים, ועל סוד מההורים מספרים"],
      "answer": 2,
      "explain": "הפתעות הן קצרות ומשמחות. כשמישהו מבקש להסתיר משהו מההורים, מספרים."
    }
  ],
  "summary": "כשמשהו ברשת מפחיד, מבלבל או לא נעים, או כשמישהו מבקש סוד מההורים, מספרים למבוגר שסומכים עליו. זה לא אשמתכם, ולספר זה תמיד הצעד הנכון."
}
