{
  "$schema": "../../schema/lesson.schema.json",
  "id": "ai-03",
  "version": 1,
  "language": "he",
  "title": "גם בינה מלאכותית טועה",
  "intro": [
    "בינה מלאכותית יכולה להישמע בטוחה מאוד בעצמה ובכל זאת לטעות. לפעמים היא אפילו ממציאה עובדות שנשמעות אמיתיות.",
    "זה קורה כי היא מנחשת את המילים הכי סבירות, ולא כי היא בדקה את העובדות.",
    "לכן כשמשהו חשוב, כמו בריאות, בטיחות או מבחן בבית הספר, בודקים עם מבוגר שסומכים עליו או במקור אמין."
  ],
  "game": {
    "type": "sort",
    "prompt": "מה עושים עם כל תשובה של בינה מלאכותית?",
    "bins": [
      { "id": "fine", "label": "בסדר בשביל הכיף" },
      { "id": "check", "label": "בודקים קודם" }
    ],
    "items": [
      {
        "id": "mushroom",
        "text": "בינה מלאכותית אומרת שפטרייה שמצאת בפארק בטוחה לאכילה",
        "bin": "check",
        "explain": "אף פעם לא אוכלים פטרייה רק כי בינה מלאכותית אמרה. פטריות בר יכולות להיות מסוכנות, אז שואלים מבוגר."
      },
      {
        "id": "drawing_name",
        "text": "בינה מלאכותית מציעה שם מצחיק לציור שלך",
        "bin": "fine",
        "explain": "שם לציור לא יכול להזיק לאף אחד. תיהנו!"
      },
      {
        "id": "history_date",
        "text": "בינה מלאכותית אומרת תאריך של אירוע חשוב בשביל מבחן",
        "bin": "check",
        "explain": "בינה מלאכותית יכולה להתבלבל בתאריכים. בודקים בספר הלימוד או עם המורה."
      },
      {
        "id": "medicine",
        "text": "בינה מלאכותית אומרת כמה תרופה לקחת נגד כאב ראש",
        "bin": "check",
        "explain": "על תרופות מחליטים רק הורה או רופא."
      },
      {
        "id": "cat_poem",
        "text": "בינה מלאכותית כותבת שיר מצחיק על החתול שלך",
        "bin": "fine",
        "explain": "שיר מצחיק הוא בשביל הכיף, אז טעויות לא משנות."
      },
      {
        "id": "safe_site",
        "text": "בינה מלאכותית אומרת שאתר מסוים בטוח להקלדת סיסמה",
        "bin": "check",
        "explain": "בינה מלאכותית יכולה לטעות בענייני בטיחות. שואלים הורה לפני שמקלידים סיסמה בכל מקום."
      }
    ]
  },
  "quiz": [
    {
      "id": "confident",
      "question": "בינה מלאכותית נשמעת בטוחה מאוד בתשובה. זה אומר שהתשובה נכונה?",
      "options": ["כן, תמיד", "לא בהכרח, היא עדיין יכולה לטעות", "רק אם היא משתמשת במילים ארוכות"],
      "answer": 1,
      "explain": "בינה מלאכותית יכולה להישמע בטוחה ובכל זאת לטעות."
    },
    {
      "id": "made_up",
      "question": "למה בינה מלאכותית ממציאה לפעמים עובדות?",
      "options": ["היא מנחשת מילים סבירות במקום לבדוק עובדות", "היא רוצה לעבוד עלינו", "היא עייפה"],
      "answer": 0,
      "explain": "בינה מלאכותית מנבאת מילים שנשמעות נכון. היא לא תמיד בודקת אם הן נכונות."
    },
    {
      "id": "health",
      "question": "בינה מלאכותית נותנת עצה על הבריאות שלך. מה עושים?",
      "options": ["עושים מה שכתוב מיד", "לא שואלים אף מבוגר", "שואלים הורה או רופא"],
      "answer": 2,
      "explain": "שאלות על בריאות שואלים הורה או רופא, לא רק בינה מלאכותית."
    }
  ],
  "summary": "בינה מלאכותית יכולה להישמע בטוחה ובכל זאת לטעות. לדברים של כיף זה בסדר; על בריאות, בטיחות או עובדות לבית הספר בודקים עם מבוגר שסומכים עליו או במקור אמין."
}
